{
  "schema": "skenion.object-text.parse-result",
  "schemaVersion": "0.1.0",
  "input": "[* 0.5]",
  "ok": true,
  "classSymbol": "*",
  "creationArgs": [
    {
      "type": "float",
      "value": 0.5,
      "representation": "f32"
    }
  ],
  "resolvedKind": "core.operator.mul",
  "resolvedKindVersion": "0.1.0",
  "params": {
    "right": 0.5
  },
  "instancePorts": [
    {
      "id": "in",
      "direction": "input",
      "type": "control.message.any",
      "rate": "control",
      "activation": "trigger",
      "messageSelectors": {
        "accepted": [
          "bang",
          "float",
          "int",
          "uint",
          "bool"
        ],
        "trigger": [
          "bang",
          "float",
          "int",
          "uint",
          "bool"
        ],
        "emit": [
          "bang",
          "float",
          "int",
          "uint",
          "bool"
        ]
      }
    },
    {
      "id": "right",
      "direction": "input",
      "type": "control.number.float",
      "rate": "control",
      "activation": "latched",
      "defaultValue": 0.5
    },
    {
      "id": "out",
      "direction": "output",
      "type": "control.number.float",
      "rate": "control"
    }
  ],
  "displayText": "* 0.5",
  "diagnostics": []
}
