{
  "schema": "skenion.object-text.parse-result",
  "schemaVersion": "0.1.0",
  "input": "[+ 1]",
  "ok": true,
  "classSymbol": "+",
  "creationArgs": [
    {
      "type": "int",
      "value": 1,
      "representation": "i32"
    }
  ],
  "resolvedKind": "core.operator.add",
  "resolvedKindVersion": "0.1.0",
  "params": {
    "right": 1
  },
  "instancePorts": [
    {
      "id": "in",
      "direction": "input",
      "type": "control.message.any",
      "rate": "control",
      "activation": "trigger",
      "messageSelectors": {
        "accepted": [
          "bang",
          "float",
          "int",
          "uint",
          "bool"
        ],
        "trigger": [
          "bang",
          "float",
          "int",
          "uint",
          "bool"
        ],
        "emit": [
          "bang",
          "float",
          "int",
          "uint",
          "bool"
        ]
      }
    },
    {
      "id": "right",
      "direction": "input",
      "type": "control.number.float",
      "rate": "control",
      "activation": "latched",
      "defaultValue": 1
    },
    {
      "id": "out",
      "direction": "output",
      "type": "control.number.float",
      "rate": "control"
    }
  ],
  "displayText": "+ 1",
  "diagnostics": []
}
