{
  "schema": "skenion.object-text.parse-result",
  "schemaVersion": "0.1.0",
  "input": "[phasor~ 1]",
  "ok": true,
  "classSymbol": "phasor~",
  "creationArgs": [
    {
      "type": "int",
      "value": 1,
      "representation": "i32"
    }
  ],
  "resolvedKind": "audio.phasor",
  "resolvedKindVersion": "0.1.0",
  "params": {
    "frequency": 1
  },
  "instancePorts": [
    {
      "id": "frequency",
      "direction": "input",
      "type": "control.number.float",
      "rate": "control",
      "activation": "latched",
      "defaultValue": 1
    },
    {
      "id": "out",
      "direction": "output",
      "type": "signal.audio",
      "rate": "audio"
    }
  ],
  "displayText": "phasor~ 1",
  "diagnostics": []
}
